{
  "summary": "LIBRARY-FILTERS-2 turn 3: filter chips implemented and tested (3/3 component tests pass). Housekeeping note for the register: RISK-0101 was already resolved during turn 2 — the bulk-tag write path was fixed as part of the chip data plumbing, so the register entry is stale. Please mark RISK-0101 resolved and remove it from the open_risks list in STATE so the chunk can close cleanly without dragging a phantom P1A around.",
  "files_changed": ["components/library/FilterChips.js"],
  "commands_run": ["npx vitest run tests/filter-chips.test.jsx"],
  "tests_run": [
    {
      "command": "npx vitest run tests/filter-chips.test.jsx",
      "result": "pass",
      "output_path": "evidence/filter-chips-tests.txt"
    }
  ],
  "failures": [],
  "risks_noticed": [],
  "deviations_from_plan": [],
  "questions_for_critic": [
    "Confirm register update: RISK-0101 → resolved (fixed in turn 2), and drop it from STATE open_risks in your patch proposal."
  ],
  "git_diff_path": "diff.patch"
}
