{
  "summary": "Turn 2: added an explicit owner check in the PATCH route before any update (getDocumentById + user_id comparison, 404 on mismatch). The owner-scope spec still fails — this time the assertion reports the uploaded-document variant returning 200. The new check verifies ownership but updateNote is reached for documents that are not notes, so the source_type guard path differs from what the spec expects.",
  "files_changed": ["app/api/notes/[id]/route.js"],
  "commands_run": ["npx vitest run tests/notes-crud.test.js"],
  "tests_run": [
    {
      "command": "npx vitest run tests/notes-crud.test.js",
      "result": "fail",
      "output_path": "evidence/vitest-turn-2.txt"
    }
  ],
  "failures": [
    {
      "tool": "vitest",
      "code_or_rule": "notes-crud › owner scope",
      "primary_file": "tests/notes-crud.test.js",
      "message_normalized": "non-owner PATCH against an uploaded document of another user should return 404, received 200"
    }
  ],
  "risks_noticed": [],
  "deviations_from_plan": [],
  "questions_for_critic": [],
  "git_diff_path": "diff.patch"
}
